<?xml version="1.0" encoding="UTF-8"?>
<xs:schema xmlns:xs="http://www.w3.org/2001/XMLSchema">
    <xs:element name="cds">
        <xs:complexType>
            <xs:sequence>
                <xs:element name="cd" minOccurs="1" maxOccurs="unbounded">
                    <xs:complexType>
                        <xs:sequence>
                            <xs:element name="artistas">
                                <xs:complexType>
                                    <xs:sequence>
                                        <xs:element name="artista" type="xs:string" minOccurs="1" maxOccurs="unbounded" />
                                    </xs:sequence>
                                </xs:complexType>
                            </xs:element>
                            <xs:element name="canciones">
                                <xs:complexType>
                                    <xs:sequence>
                                        <xs:element name="cancion" minOccurs="1" maxOccurs="unbounded">
                                            <xs:complexType>
                                                <xs:simpleContent>
                                                    <xs:extension base="xs:string">
                                                        <xs:attribute name="duracion" type="xs:time" use="required" />
                                                    </xs:extension>
                                                </xs:simpleContent>
                                            </xs:complexType>
                                        </xs:element>
                                    </xs:sequence>
                                </xs:complexType>
                            </xs:element>
                            <xs:element name="sellos_discograficos">
                                <xs:complexType>
                                    <xs:sequence>
                                        <xs:element name="sello_discografico" type="xs:string" minOccurs="1" maxOccurs="unbounded" />
                                    </xs:sequence>
                                </xs:complexType>
                            </xs:element>
                        </xs:sequence>
                        <xs:attribute name="titulo_album" type="xs:string" use="required" />
                        <xs:attribute name="aÃ±o_publicacion" type="xs:integer" use="required" />
                    </xs:complexType>
                </xs:element>
            </xs:sequence>
        </xs:complexType>
    </xs:element>
</xs:schema>